{"authoritativeSource":"https://api.wordpress.org/core/version-check/1.7/","candidateSignalCount":0,"canonicalHash":"dd5a2022bf9322cab79ff0a7b9d3a0a18eff391bae67daff9ccb9b0a88267fc3","certifiedTime":"2026-10-06T11:51:55Z","completeness":"COMPLETE","freshness":"fresh","health":{"failure":null,"state":"certified"},"label":"WordPress beta, release-candidate, and development builds","limitations":["Certification is limited to current beta and development channel offers.","A public source object does not become a candidate unless the adapter records a specific contribution signal."],"machineReadableAccess":["https://api.wordpress.org/core/version-check/1.7/?channel=beta","https://api.wordpress.org/core/version-check/1.7/?channel=development"],"observedTime":"2026-10-06T11:51:55Z","outcomeObservers":["channel offer revision","new prerelease build","stable release supersession"],"rawAcquisitions":[{"acquisitionId":"raw-acquisition-v1-d10520b64e431adff32e0b27","byteLength":13978,"etag":null,"httpStatus":200,"lastModified":null,"mediaType":"application/json; charset=utf-8","pagination":{"nextPagePresent":false,"total":null,"totalPages":null},"rawArtifact":"data/raw/sources/wordpress-releases/2026-10-06T11-51-55Z/001.json","rawSha256":"d10520b64e431adff32e0b27b34ee74e631f68e7743d15ec77c60b2c702a1387","retrievedAt":"2026-10-06T11:51:55Z","schema":"wordpress.raw-acquisition.v1","sourceUrl":"https://api.wordpress.org/core/version-check/1.7/?channel=beta","version":1},{"acquisitionId":"raw-acquisition-v1-6ee8086b05e16bc4d93f7128","byteLength":1436,"etag":null,"httpStatus":200,"lastModified":null,"mediaType":"application/json; charset=utf-8","pagination":{"nextPagePresent":false,"total":null,"totalPages":null},"rawArtifact":"data/raw/sources/wordpress-releases/2026-10-06T11-51-55Z/002.json","rawSha256":"6ee8086b05e16bc4d93f71289d411cfc2c235eb4f41e099e77640293f0b2d29f","retrievedAt":"2026-10-06T11:51:55Z","schema":"wordpress.raw-acquisition.v1","sourceUrl":"https://api.wordpress.org/core/version-check/1.7/?channel=development","version":1}],"recordCount":29,"resources":[{"bodyExcerpt":"","bodyHash":"df7bdfbdc37d4a88dee020995fedae567697294d7eb6496aef54a35f6dd4733d","candidateSignals":[],"createdAt":null,"labels":["beta","autoupdate"],"nativeId":"beta:en_US:4.7.37:autoupdate","nativeIdentity":"offer/beta/en_US/4.7.37/autoupdate","outboundLinks":["https://downloads.w.org/release/wordpress-4.7.37.zip"],"resourceType":"WORDPRESS_RELEASE_OFFER","sourceRevision":"df7bdfbdc37d4a88dee020995fedae567697294d7eb6496aef54a35f6dd4733d","state":"autoupdate","title":"WordPress 4.7.37 (beta)","updatedAt":null,"url":"https://downloads.w.org/release/wordpress-4.7.37.zip"},{"bodyExcerpt":"","bodyHash":"4d3e76fd4dd48968e597afc5e030e09df29938cfc724ca8a2504f5cf2e77432d","candidateSignals":[],"createdAt":null,"labels":["beta","autoupdate"],"nativeId":"beta:en_US:4.8.32:autoupdate","nativeIdentity":"offer/beta/en_US/4.8.32/autoupdate","outboundLinks":["https://downloads.w.org/release/wordpress-4.8.32.zip"],"resourceType":"WORDPRESS_RELEASE_OFFER","sourceRevision":"4d3e76fd4dd48968e597afc5e030e09df29938cfc724ca8a2504f5cf2e77432d","state":"autoupdate","title":"WordPress 4.8.32 (beta)","updatedAt":null,"url":"https://downloads.w.org/release/wordpress-4.8.32.zip"},{"bodyExcerpt":"","bodyHash":"c68ce17ba231ed95bb9648a3cf6ce7947c8b990f153fec2dc01b386ef15280c3","candidateSignals":[],"createdAt":null,"labels":["beta","autoupdate"],"nativeId":"beta:en_US:4.9.33:autoupdate","nativeIdentity":"offer/beta/en_US/4.9.33/autoupdate","outboundLinks":["https://downloads.w.org/release/wordpress-4.9.33.zip"],"resourceType":"WORDPRESS_RELEASE_OFFER","sourceRevision":"c68ce17ba231ed95bb9648a3cf6ce7947c8b990f153fec2dc01b386ef15280c3","state":"autoupdate","title":"WordPress 4.9.33 (beta)","updatedAt":null,"url":"https://downloads.w.org/release/wordpress-4.9.33.zip"},{"bodyExcerpt":"","bodyHash":"1e14e91f46f71ccc16d258cb320c6b4cc82d49f58638b6997a04587262b43c8b","candidateSignals":[],"createdAt":null,"labels":["beta","autoupdate"],"nativeId":"beta:en_US:5.0.29:autoupdate","nativeIdentity":"offer/beta/en_US/5.0.29/autoupdate","outboundLinks":["https://downloads.w.org/release/wordpress-5.0.29.zip"],"resourceType":"WORDPRESS_RELEASE_OFFER","sourceRevision":"1e14e91f46f71ccc16d258cb320c6b4cc82d49f58638b6997a04587262b43c8b","state":"autoupdate","title":"WordPress 5.0.29 (beta)","updatedAt":null,"url":"https://downloads.w.org/release/wordpress-5.0.29.zip"},{"bodyExcerpt":"","bodyHash":"97dcaef5d84fec50d12878a2ca3306ee879903bc05a364cbe37cb7074215d2f9","candidateSignals":[],"createdAt":null,"labels":["beta","autoupdate"],"nativeId":"beta:en_US:5.1.26:autoupdate","nativeIdentity":"offer/beta/en_US/5.1.26/autoupdate","outboundLinks":["https://downloads.w.org/release/wordpress-5.1.26.zip"],"resourceType":"WORDPRESS_RELEASE_OFFER","sourceRevision":"97dcaef5d84fec50d12878a2ca3306ee879903bc05a364cbe37cb7074215d2f9","state":"autoupdate","title":"WordPress 5.1.26 (beta)","updatedAt":null,"url":"https://downloads.w.org/release/wordpress-5.1.26.zip"},{"bodyExcerpt":"","bodyHash":"2debadeab8f81b8e13a50e624093045c11216bdb8c7d8e38360525c2947d1b79","candidateSignals":[],"createdAt":null,"labels":["beta","autoupdate"],"nativeId":"beta:en_US:5.2.28:autoupdate","nativeIdentity":"offer/beta/en_US/5.2.28/autoupdate","outboundLinks":["https://downloads.w.org/release/wordpress-5.2.28.zip"],"resourceType":"WORDPRESS_RELEASE_OFFER","sourceRevision":"2debadeab8f81b8e13a50e624093045c11216bdb8c7d8e38360525c2947d1b79","state":"autoupdate","title":"WordPress 5.2.28 (beta)","updatedAt":null,"url":"https://downloads.w.org/release/wordpress-5.2.28.zip"},{"bodyExcerpt":"","bodyHash":"b0bcdfb40c84609d7c62d6f0c8469d5eefb1830406fd51af35edefdb222576e2","candidateSignals":[],"createdAt":null,"labels":["beta","autoupdate"],"nativeId":"beta:en_US:5.3.25:autoupdate","nativeIdentity":"offer/beta/en_US/5.3.25/autoupdate","outboundLinks":["https://downloads.w.org/release/wordpress-5.3.25.zip"],"resourceType":"WORDPRESS_RELEASE_OFFER","sourceRevision":"b0bcdfb40c84609d7c62d6f0c8469d5eefb1830406fd51af35edefdb222576e2","state":"autoupdate","title":"WordPress 5.3.25 (beta)","updatedAt":null,"url":"https://downloads.w.org/release/wordpress-5.3.25.zip"},{"bodyExcerpt":"","bodyHash":"3ccbad59e07ea99ebfc02fe56dce34b9dae77e985466c852cd9fceaca2e59029","candidateSignals":[],"createdAt":null,"labels":["beta","autoupdate"],"nativeId":"beta:en_US:5.4.23:autoupdate","nativeIdentity":"offer/beta/en_US/5.4.23/autoupdate","outboundLinks":["https://downloads.w.org/release/wordpress-5.4.23.zip"],"resourceType":"WORDPRESS_RELEASE_OFFER","sourceRevision":"3ccbad59e07ea99ebfc02fe56dce34b9dae77e985466c852cd9fceaca2e59029","state":"autoupdate","title":"WordPress 5.4.23 (beta)","updatedAt":null,"url":"https://downloads.w.org/release/wordpress-5.4.23.zip"},{"bodyExcerpt":"","bodyHash":"8ac56d2ebbec9eaa64debec2b9046221078b6b59e918d616c8d4f6859fc82c32","candidateSignals":[],"createdAt":null,"labels":["beta","autoupdate"],"nativeId":"beta:en_US:5.5.22:autoupdate","nativeIdentity":"offer/beta/en_US/5.5.22/autoupdate","outboundLinks":["https://downloads.w.org/release/wordpress-5.5.22.zip"],"resourceType":"WORDPRESS_RELEASE_OFFER","sourceRevision":"8ac56d2ebbec9eaa64debec2b9046221078b6b59e918d616c8d4f6859fc82c32","state":"autoupdate","title":"WordPress 5.5.22 (beta)","updatedAt":null,"url":"https://downloads.w.org/release/wordpress-5.5.22.zip"},{"bodyExcerpt":"","bodyHash":"4e48afad384d8d931a8d7b5c03ff0be5789e1b0322075c708b551572b07f2cc5","candidateSignals":[],"createdAt":null,"labels":["beta","autoupdate"],"nativeId":"beta:en_US:5.6.21:autoupdate","nativeIdentity":"offer/beta/en_US/5.6.21/autoupdate","outboundLinks":["https://downloads.w.org/release/wordpress-5.6.21.zip"],"resourceType":"WORDPRESS_RELEASE_OFFER","sourceRevision":"4e48afad384d8d931a8d7b5c03ff0be5789e1b0322075c708b551572b07f2cc5","state":"autoupdate","title":"WordPress 5.6.21 (beta)","updatedAt":null,"url":"https://downloads.w.org/release/wordpress-5.6.21.zip"},{"bodyExcerpt":"","bodyHash":"a43bde0020b1ef7436f576d180acc1df74104466b35d36b3d7fe8882d274c9b8","candidateSignals":[],"createdAt":null,"labels":["beta","autoupdate"],"nativeId":"beta:en_US:5.7.19:autoupdate","nativeIdentity":"offer/beta/en_US/5.7.19/autoupdate","outboundLinks":["https://downloads.w.org/release/wordpress-5.7.19.zip"],"resourceType":"WORDPRESS_RELEASE_OFFER","sourceRevision":"a43bde0020b1ef7436f576d180acc1df74104466b35d36b3d7fe8882d274c9b8","state":"autoupdate","title":"WordPress 5.7.19 (beta)","updatedAt":null,"url":"https://downloads.w.org/release/wordpress-5.7.19.zip"},{"bodyExcerpt":"","bodyHash":"bbb81c6e7a1779e60bb81eafbc9bb2d392e8666c756e01dd04dfa1d8f70e589d","candidateSignals":[],"createdAt":null,"labels":["beta","autoupdate"],"nativeId":"beta:en_US:5.8.17:autoupdate","nativeIdentity":"offer/beta/en_US/5.8.17/autoupdate","outboundLinks":["https://downloads.w.org/release/wordpress-5.8.17.zip"],"resourceType":"WORDPRESS_RELEASE_OFFER","sourceRevision":"bbb81c6e7a1779e60bb81eafbc9bb2d392e8666c756e01dd04dfa1d8f70e589d","state":"autoupdate","title":"WordPress 5.8.17 (beta)","updatedAt":null,"url":"https://downloads.w.org/release/wordpress-5.8.17.zip"},{"bodyExcerpt":"","bodyHash":"a4ad9c4cda34daab7b643d340cc2b18710b29da4c8389c9919aff861708121c3","candidateSignals":[],"createdAt":null,"labels":["beta","autoupdate"],"nativeId":"beta:en_US:5.9.18:autoupdate","nativeIdentity":"offer/beta/en_US/5.9.18/autoupdate","outboundLinks":["https://downloads.w.org/release/wordpress-5.9.18.zip"],"resourceType":"WORDPRESS_RELEASE_OFFER","sourceRevision":"a4ad9c4cda34daab7b643d340cc2b18710b29da4c8389c9919aff861708121c3","state":"autoupdate","title":"WordPress 5.9.18 (beta)","updatedAt":null,"url":"https://downloads.w.org/release/wordpress-5.9.18.zip"},{"bodyExcerpt":"","bodyHash":"0cea53f178850eee819b32cd289f93f5ccf6ecc5fe3d6924b07c4851f544bfd3","candidateSignals":[],"createdAt":null,"labels":["beta","autoupdate"],"nativeId":"beta:en_U